{
  "schema_version": "writing-style.requirements-matrix.v1",
  "generated_for_release": "2026-09-14",
  "requirements": [
    {
      "id": "WS-GEN-0001",
      "source_location": "canonical/instructions/claim-preserving-writing.md",
      "scope": "all writing-producing workflows",
      "canonical_destination": "canonical/instructions/writing-style-settings.md",
      "workflows": ["draft-writing", "deep-research-workflow", "research-briefing", "research-report-reviewer", "research-verification-gate", "source-research", "agent-group-discuss", "prose", "paper-review", "annotated-review", "research-digest-wrapper", "rss-news-digest", "submission-venue-selector", "autonomous-research-loop"],
      "targets": ["codex", "claude", "deepseek", "opencode", "antigravity", "grok", "kimi"],
      "test_ids": ["WS-T-0001"],
      "mechanical_status": "deterministic"
    },
    {
      "id": "WS-GEN-0002",
      "source_location": "canonical/instructions/claim-preserving-writing.md",
      "scope": "all writing-producing workflows",
      "canonical_destination": "canonical/instructions/writing-style-settings.md",
      "workflows": ["draft-writing", "deep-research-workflow", "research-report-reviewer", "research-verification-gate", "source-research", "agent-group-discuss", "prose", "paper-review", "annotated-review", "research-digest-wrapper", "rss-news-digest", "submission-venue-selector", "autonomous-research-loop"],
      "targets": ["codex", "claude", "deepseek", "opencode", "antigravity", "grok", "kimi"],
      "test_ids": ["WS-T-0002"],
      "mechanical_status": "deterministic"
    },
    {
      "id": "WS-GEN-0003",
      "source_location": "canonical/instructions/language-style-rules.md",
      "scope": "all writing-producing workflows",
      "canonical_destination": "canonical/instructions/writing-style-settings.md",
      "workflows": ["draft-writing", "deep-research-workflow", "research-report-reviewer", "source-research", "agent-group-discuss", "prose", "paper-review", "annotated-review", "research-digest-wrapper", "rss-news-digest", "submission-venue-selector", "autonomous-research-loop"],
      "targets": ["codex", "claude", "deepseek", "opencode", "antigravity", "grok", "kimi"],
      "test_ids": ["WS-T-0003"],
      "mechanical_status": "reviewed-non-mechanical"
    },
    {
      "id": "WS-GEN-0004",
      "source_location": "canonical/instructions/language-style-rules.md",
      "scope": "all writing-producing workflows",
      "canonical_destination": "canonical/instructions/writing-style-settings.md",
      "workflows": ["draft-writing", "deep-research-workflow", "research-report-reviewer", "research-verification-gate", "paper-review", "annotated-review", "submission-venue-selector"],
      "targets": ["codex", "claude", "deepseek", "opencode", "antigravity", "grok", "kimi"],
      "test_ids": ["WS-T-0004"],
      "mechanical_status": "deterministic"
    },
    {
      "id": "WS-GEN-0005",
      "source_location": "canonical/instructions/language-style-rules.md",
      "scope": "all writing-producing workflows",
      "canonical_destination": "canonical/instructions/writing-style-settings.md",
      "workflows": ["draft-writing", "deep-research-workflow", "paper-review", "annotated-review", "submission-venue-selector"],
      "targets": ["codex", "claude", "deepseek", "opencode", "antigravity", "grok", "kimi"],
      "test_ids": ["WS-T-0005"],
      "mechanical_status": "reviewed-non-mechanical"
    },
    {
      "id": "WS-GEN-0006",
      "source_location": "plan_v10",
      "scope": "finalizable writing-producing workflows",
      "canonical_destination": "canonical/instructions/writing-style-settings.md",
      "workflows": ["draft-writing", "deep-research-workflow", "research-verification-gate", "agent-group-discuss", "prose", "paper-review", "annotated-review", "research-digest-wrapper", "rss-news-digest", "submission-venue-selector", "autonomous-research-loop"],
      "targets": ["codex", "claude", "deepseek", "opencode", "antigravity", "grok", "kimi"],
      "test_ids": ["WS-T-0006"],
      "mechanical_status": "deterministic"
    },
    {
      "id": "WS-GEN-0007",
      "source_location": "plan_v10",
      "scope": "all writing-producing sessions",
      "canonical_destination": "canonical/instructions/writing-style-settings.md",
      "workflows": ["draft-writing", "deep-research-workflow", "source-research", "agent-group-discuss", "prose", "autonomous-research-loop"],
      "targets": ["codex", "claude", "deepseek", "opencode", "antigravity", "grok", "kimi"],
      "test_ids": ["WS-T-0007"],
      "mechanical_status": "deterministic"
    },
    {
      "id": "WS-GEN-0008",
      "source_location": "user-requirement",
      "scope": "research-paper and research-note writing workflows",
      "canonical_destination": "canonical/instructions/writing-style-settings.md",
      "workflows": ["draft-writing", "deep-research-workflow", "research-report-reviewer", "source-research", "agent-group-discuss", "prose", "paper-review", "annotated-review", "research-digest-wrapper", "rss-news-digest", "submission-venue-selector", "autonomous-research-loop"],
      "targets": ["codex", "claude", "deepseek", "opencode", "antigravity", "grok", "kimi"],
      "test_ids": ["WS-T-0008"],
      "mechanical_status": "reviewed-non-mechanical"
    },
    {
      "id": "WS-MATH-0001",
      "source_location": "canonical/instructions/language-style-rules.md",
      "scope": "math manuscripts",
      "canonical_destination": "canonical/instructions/math-manuscript-style.md",
      "workflows": ["draft-writing", "deep-research-workflow", "paper-review", "annotated-review", "submission-venue-selector"],
      "targets": ["codex", "claude", "deepseek", "opencode", "antigravity", "grok", "kimi"],
      "test_ids": ["WS-T-0101"],
      "mechanical_status": "deterministic"
    },
    {
      "id": "WS-MATH-0002",
      "source_location": "user-requirement",
      "scope": "math manuscripts",
      "canonical_destination": "canonical/instructions/math-manuscript-style.md",
      "workflows": ["draft-writing", "deep-research-workflow", "paper-review", "annotated-review", "submission-venue-selector"],
      "targets": ["codex", "claude", "deepseek", "opencode", "antigravity", "grok", "kimi"],
      "test_ids": ["WS-T-0102"],
      "mechanical_status": "deterministic"
    },
    {
      "id": "WS-MATH-0003",
      "source_location": "canonical/instructions/language-style-rules.md",
      "scope": "math manuscripts",
      "canonical_destination": "canonical/instructions/math-manuscript-style.md",
      "workflows": ["draft-writing", "deep-research-workflow", "paper-review", "annotated-review", "submission-venue-selector"],
      "targets": ["codex", "claude", "deepseek", "opencode", "antigravity", "grok", "kimi"],
      "test_ids": ["WS-T-0103"],
      "mechanical_status": "reviewed-non-mechanical"
    },
    {
      "id": "WS-MATH-0004",
      "source_location": "canonical/instructions/language-style-rules.md",
      "scope": "math manuscripts",
      "canonical_destination": "canonical/instructions/math-manuscript-style.md",
      "workflows": ["draft-writing", "deep-research-workflow", "paper-review", "annotated-review", "submission-venue-selector"],
      "targets": ["codex", "claude", "deepseek", "opencode", "antigravity", "grok", "kimi"],
      "test_ids": ["WS-T-0104"],
      "mechanical_status": "deterministic"
    },
    {
      "id": "WS-MATH-0005",
      "source_location": "canonical/instructions/language-style-rules.md",
      "scope": "math manuscripts",
      "canonical_destination": "canonical/instructions/math-manuscript-style.md",
      "workflows": ["draft-writing", "deep-research-workflow", "paper-review", "annotated-review", "submission-venue-selector"],
      "targets": ["codex", "claude", "deepseek", "opencode", "antigravity", "grok", "kimi"],
      "test_ids": ["WS-T-0105"],
      "mechanical_status": "reviewed-non-mechanical"
    },
    {
      "id": "WS-MATH-0006",
      "source_location": "user-requirement",
      "scope": "math manuscripts",
      "canonical_destination": "canonical/instructions/math-manuscript-style.md",
      "workflows": ["draft-writing", "deep-research-workflow"],
      "targets": ["codex", "claude", "deepseek", "opencode", "antigravity", "grok", "kimi"],
      "test_ids": ["WS-T-0106"],
      "mechanical_status": "reviewed-non-mechanical"
    },
    {
      "id": "WS-MATH-0007",
      "source_location": "canonical/instructions/language-style-rules.md",
      "scope": "math manuscripts",
      "canonical_destination": "canonical/instructions/math-manuscript-style.md",
      "workflows": ["draft-writing", "deep-research-workflow"],
      "targets": ["codex", "claude", "deepseek", "opencode", "antigravity", "grok", "kimi"],
      "test_ids": ["WS-T-0107"],
      "mechanical_status": "reviewed-non-mechanical"
    },
    {
      "id": "WS-MATH-0008",
      "source_location": "user-requirement",
      "scope": "math manuscripts",
      "canonical_destination": "canonical/instructions/math-manuscript-style.md",
      "workflows": ["draft-writing", "deep-research-workflow", "paper-review", "annotated-review", "submission-venue-selector"],
      "targets": ["codex", "claude", "deepseek", "opencode", "antigravity", "grok", "kimi"],
      "test_ids": ["WS-T-0108"],
      "mechanical_status": "reviewed-non-mechanical"
    },
    {
      "id": "WS-MATH-0009",
      "source_location": "Knuth, Larrabee and Roberts, Mathematical Writing (1989), rule 11",
      "scope": "math manuscripts",
      "canonical_destination": "canonical/instructions/math-manuscript-style.md",
      "workflows": ["draft-writing", "deep-research-workflow", "paper-review", "annotated-review", "submission-venue-selector"],
      "targets": ["codex", "claude", "deepseek", "opencode", "antigravity", "grok", "kimi"],
      "test_ids": ["WS-T-0109"],
      "mechanical_status": "deterministic"
    },
    {